land_area,price,region
10 сот,120000.0,"Липецкая область, Становлянский р-н, с. Становое"
15 сот,200000.0,"Тверская область, Конаковский р-н, городское поселение Редкино, пос. городского типа Редкино"
15 сот,850000.0,"Владимирская область, Петушинский р-н, д. Иваново"
6 сот,1300000.0,"Республика Калмыкия, Элиста"
15 сот,850000.0,"Владимирская область, Петушинский р-н, д. Иваново"
12 сот,600000.0,"Ленинградская область, Выборгский р-н, Выборгское городское поселение, Выборг"
5.1 сот,650000.0,"Ярославская область, Ярославский р-н, СНТ Мечта"
10 сот,350000.0,"Ярославская область, Ярославский р-н, д. Боровая"
6 сот,999000.0,"Республика Татарстан, Лаишевский р-н, Матюшинское сельское поселение, д. Матюшино"
15 сот,1305000.0,"Московская область, Раменский г.о., д. Захарово"
8 сот,1720000.0,
15 сот,400000.0,
15 сот,5000000.0,
8 сот,1800000.0,"Тюменская область, Тюменский р-н, с. Кулаково"
15 сот,35000.0,"Тверская область, Ржевский р-н, д. Варатово"
25 сот,2500000.0,Ленинградская область
6 сот,50000.0,
12.2 га,6000000.0,
14 сот,2250000.0,
1 сот,500000.0,"Республика Крым, г.о. Ялта, пос. городского типа Парковое"
15 сот,40000.0,"Воронежская область, Каширский р-н, СНТ Содружество"
10 сот,1800000.0,"Самарская область, Ставропольский р-н, с. Подстёпки"
80 сот,1500000.0,"Ростовская область, Неклиновский р-н, хутор Калиновка"
6 сот,240000.0,"Свердловская область, муниципальное образование Город Каменск-Уральский, д. Монастырка"
17 сот,590000.0,"Ленинградская область, Волховский р-н, Потанинское сельское поселение"
12 сот,550000.0,"Республика Татарстан, Лаишевский р-н, д. Тангачи"
5.6 сот,2800000.0,"Краснодарский край, г.о. Сочи, с. Русская Мамайка, СДТ Тюльпан"
8.4 сот,6950000.0,"Московская область, г.о. Люберцы, рабочий пос. Томилино"
10 сот,500000.0,"Республика Башкортостан, Ишимбайский р-н, Ишимбай"
5 сот,120000.0,"Ивановская область, Ивановский р-н, СНТ Кадниково"
12 сот,620000.0,"Пермский край, Пермский р-н, д. Гарюшки"
6 сот,1700000.0,"Ставропольский край, Пятигорск, СТ Строитель-1"
2 га,1300000.0,Московская область
15 сот,550000.0,"Тульская область, Венёвский р-н, д. Анишино"
7 сот,250000.0,"Тюменская область, Нижневартовск, садово-огородническое некоммерческое товарищество Кедровый"
4 сот,70000.0,"Пермский край, Пермь, СНТ Крым-59"
45 сот,320000.0,"Московская область, г.о. Шаховская, д. Акинькино"
8.4 сот,486000.0,"Ленинградская область, Гатчинский р-н, Пудомягское сельское поселение, коттеджный пос. Павловский посад"
30 сот,450000.0,"Краснодарский край, Северский р-н, с. Львовское"
20 сот,270000.0,"Владимирская область, Собинский р-н, д. Федотово"
6.9 сот,2190000.0,"Московская область, г.о. Подольск, коттеджный пос. Никулино"
6 сот,300000.0,"Республика Дагестан, Кумторкалинский р-н"
6 сот,370000.0,"Ленинградская область, Выборгский р-н, Гончаровское сельское поселение, пос. Гвардейское"
12 сот,270000.0,"Московская область, Черусти"
12 сот,650000.0,"Московская область, Можайский г.о., пос. Бородино"
7.1 сот,589000.0,"Республика Татарстан, Пестречинский р-н, Кулаевское сельское поселение, коттеджный пос. Мёшинские усадьбы"
6 сот,4500000.0,"Республика Крым, Симферополь"
6 сот,900000.0,"Чеченская Республика, Грозный"
15 сот,90000.0,"Белгородская область, Красногвардейский р-н, с. Ливенка"
8 сот,300000.0,"Краснодарский край, Динской р-н, пос. Янтарный"
29 сот,1160000.0,"Московская область, г.о. Луховицы, с. Троицкие Борки"
8.5 сот,35000.0,"Алтайский край, Бийск, СНТ Монтажник"
6 сот,200000.0,"Калининградская область, Зеленоградский г.о., садовое товарищество Бриз"
20 сот,300000.0,"Тульская область, Заокский р-н, с. Дмитриевское"
11 сот,4000000.0,"Московская область, Щёлково"
9 сот,18500000.0,"Челябинская область, Челябинск"
10 сот,300000.0,"Воронежская область, Рамонский р-н, с. Солнце-Дубрава"
12 сот,840000.0,"Калужская область, Боровский р-н, с. Ворсино"
25 сот,300000.0,"Московская область, Можайский г.о., дачное некоммерческое партнёрство Горизонты"
5 сот,5000000.0,"Ставропольский край, Кисловодск"
10 сот,650000.0,"Челябинская область, Копейск"
9.5 сот,450000.0,"Нижегородская область, Богородский муниципальный округ, с. Ефимьево"
6 сот,270000.0,"Республика Татарстан, Лаишевский р-н, садоводческое некоммерческое товарищество Горизонт"
10 сот,140000.0,"Белгородская область, Белгородский р-н, с. Пушкарное"
,,"Тульская область, Донской, садовые участки"
8 сот,1300000.0,"Чеченская Республика, Грозный"
6 сот,1000000.0,
8 сот,560000.0,
29 сот,500000.0,
4 сот,650000.0,"Ставропольский край, г.о. Кисловодск, СТ Кисловодск"
12 сот,700000.0,"Республика Крым, Сакский р-н, Охотниковское сельское поселение, с. Орлянка"
15 сот,1000000.0,"Московская область, Дмитровский г.о., д. Кочергино"
10 сот,350000.0,
9 сот,7000000.0,
7 сот,591000.0,
10.1 сот,1200000.0,"Новосибирская область, Новосибирский р-н, садовое товарищество СПО Учхоз"
5 сот,1600000.0,"Севастополь, садоводческое товарищество Алькадар"
12 сот,1450000.0,"Нижегородская область, Балахнинский р-н, Балахна"
8.5 сот,700000.0,"Калужская область, Калуга"
10 сот,345000.0,"Воронежская область, Семилукский р-н, с. Семилуки"
22 сот,1200000.0,"Московская область, Раменский г.о., коттеджный пос. Черёмушки"
1.03 га,120000.0,"Тверская область, Лихославльский р-н, д. Дубиха"
7.2 сот,650000.0,"Республика Крым, г.о. Керчь, садово-огороднический кооператив Залив"
20 сот,1200000.0,"Московская область, г.о. Истра, с. Онуфриево"
8 сот,640000.0,"Калужская область, Жуковский р-н, д. Колесниково"
10 сот,300000.0,"Республика Дагестан, Кумторкалинский р-н, садовое товарищество Прибор-3"
16 сот,580000.0,"Ленинградская область, Кировский р-н, Мгинское городское поселение, садовое товарищество Славянка, садоводческое некоммерческое товарищество Заречное"
4 сот,2200000.0,"Краснодарский край, Новороссийск"
7.5 сот,150000.0,"Ярославская область, Рыбинский р-н, Огарковское сельское поселение, д. Волково"
7.5 сот,400000.0,"Московская область, Сергиево-Посадский г.о., СНТ Луч-2"
10 сот,480000.0,"Ярославская область, Ярославский р-н, д. Боровая"
7.2 сот,2000000.0,"Ростовская область, Ростов-на-Дону"
15 сот,750000.0,"Республика Татарстан, Тукаевский р-н, д. Биюрган"
8 сот,250000.0,"Московская область, Сергиево-Посадский г.о., д. Путятино"
10 сот,650000.0,"Республика Северная Осетия — Алания, Пригородный р-н, с. Ир"
12.5 сот,1500000.0,"Краснодарский край, Темрюкский р-н, станица Голубицкая"
12 сот,180000.0,"Тульская область, муниципальное образование Ефремов, с. Шилово"
8 сот,140000.0,"Удмуртская Республика, Завьяловский р-н, д. Сизево"
60 сот,6500000.0,"Тульская область, Заокский р-н, д. Гибкино"
20 сот,350000.0,"Нижегородская область, Богородский р-н, коттеджный пос. Бурцево"
8 сот,400000.0,"Самарская область, Волжский р-н, сельское поселение Лопатино, пос. Самарский"
10 сот,30000.0,"Кировская область, Слободской р-н"
10 сот,140000.0,"Ярославская область, г.о. Переславль-Залесский, с. Нагорье"
40 сот,2700000.0,"Краснодарский край, Динской р-н, с. Примаки"
7 сот,800000.0,"Ставропольский край, Ставрополь"
16 сот,800000.0,"Республика Ингушетия, Сунжа"
25 сот,50000.0,"Кемеровская область, Топкинский муниципальный округ, с. Глубокое"
109 га,8000000.0,"Московская область, Луховицы"
6 сот,3500000.0,"Республика Крым, Симферополь"
40 сот,510000.0,"Ярославская область, г.о. Переславль-Залесский, с. Купанское"
16 сот,900000.0,"Самарская область, Ставропольский р-н, с. Хрящёвка"
17.5 сот,950000.0,"Воронежская область, Рамонский р-н, СНТ Жемчужина-2"
5 сот,5400000.0,"Республика Крым, г.о. Ялта, пос. городского типа Восход"
10 сот,1800000.0,"Республика Крым, Симферопольский р-н, Трудовское сельское поселение, товарищество собственников недвижимости Мечта"
18 сот,700000.0,"Самарская область, Самара, СНТ Золотые Пески ВМЗ"
10 сот,1800000.0,"Республика Крым, Симферопольский р-н, Трудовское сельское поселение, товарищество собственников недвижимости Мечта"
6 сот,350000.0,"Рязанская область, Рязанский р-н, Мурминское сельское поселение, садоводческое товарищество Сапфир"
6 сот,160000.0,"Московская область, г.о. Шаховская, коттеджный пос. Новорижские Сады"
8 сот,4000000.0,"Краснодарский край, Сочи"
15 сот,150000.0,"Челябинская область, Аргаяшский р-н, д. Камышевка"
6 сот,490000.0,"Республика Алтай, Горно-Алтайск"
100 га,1200000.0,"Смоленская область, Угранский р-н, д. Михали"
10 сот,250000.0,
64 га,2000000.0,
3.4 сот,750000.0,
36 сот,700000.0,Ламия
6 сот,50000.0,"Тульская область, Новомосковск"
10 сот,3400000.0,Севастополь
24 сот,10800000.0,
5 сот,1599000.0,
10 сот,250000.0,
14 сот,800000.0,"Владимирская область, Суздальский р-н, муниципальное образование Город Суздаль, Суздаль"
12.6 сот,500000.0,"Нижегородская область, Дальнеконстантиновский р-н"
5 сот,400000.0,"Краснодарский край, Динской р-н, пос. Янтарный"
16.7 сот,199000.0,"Пермский край, Пермский р-н, Усть-Качкинское сельское поселение, д. Одина"
9 сот,630000.0,"Московская область, г.о. Чехов, территория Новое Ивановское"
8 сот,400000.0,"Самарская область, Кинельский р-н, пос. Энергия"
15 сот,180000.0,"Самарская область, Кинельский р-н, с. Бобровка"
15 сот,900000.0,"Тульская область, Алексин"
15 сот,100000.0,Красноярский край
4 сот,7000000.0,"Краснодарский край, г.о. Сочи, с. Нижняя Шиловка"
15 сот,450000.0,"Тверская область, Кимрский р-н, д. Кокоурово"
6.5 сот,1300000.0,"Ярославская область, Рыбинск"
8 сот,1500000.0,"Республика Крым, г.о. Алушта, с. Верхняя Кутузовка"
8 сот,199000.0,"Краснодарский край, муниципальное образование Анапа, садоводческое товарищество Персик"
12 сот,300000.0,"Чувашская Республика, Шумерля"
10 сот,900000.0,"Московская область, Рузский г.о., садоводческое некоммерческое товарищество Надежда"
8 сот,180000.0,"Ленинградская область, Волховский р-н, Кисельнинское сельское поселение, садоводческий массив Пупышево, садоводческое некоммерческое товарищество Баррикадовец"
15 сот,1900000.0,"Ярославская область, г.о. Переславль-Залесский, КП Савельево"
10 сот,1900000.0,"Республика Саха (Якутия), Томпонский муниципальный р-н, пос. Хандыга"
15 сот,1350000.0,"Московская область, г.о. Истра, д. Рубцово"
3 га,16000.0,"Ярославская область, Ярославский р-н, Заволжское сельское поселение"
10 сот,39000.0,"Ярославская область, Некрасовский р-н, сельское поселение Бурмакино"
80 сот,150000.0,"Воронежская область, Рамонский р-н, рабочий пос. Рамонь"
2.1 сот,2000000.0,"Краснодарский край, Сочи, СНТ Железобетон"
15 сот,670000.0,"Калужская область, Боровский р-н, д. Добрино"
18 сот,320000.0,"Московская область, г.о. Электросталь, СНТ Мечта"
10 сот,500000.0,"Кабардино-Балкарская Республика, Баксан"
23 сот,1500000.0,"Ярославская область, г.о. Переславль-Залесский, с. Ям"
8 сот,250000.0,"Иркутская область, Иркутский р-н, СНТ Клён"
9 сот,2750000.0,"Ленинградская область, Кировский р-н, Павловское городское поселение, городской пос. Павлово"
8.7 га,7000000.0,"Крым, Гвардейское"
8 сот,60000.0,"Кемеровская область, Новокузнецкий р-н, садовые участки Металлург-10"
25 сот,420000.0,"Пермский край, Добрянский г.о., с. Шемети"
12.8 сот,450000.0,"Московская область, г.о. Истра, д. Бужарово"
16 сот,2000000.0,"Орловская область, Орловский р-н, пос. Горки"
15 сот,70000.0,"Новгородская область, Шимский р-н, д. Дубовицы"
50 сот,500000.0,"Курская область, Курский р-н, с. Полянское"
5.5 сот,250000.0,"Ставропольский край, Георгиевский г.о., станица Незлобная"
10 сот,640000.0,"Республика Крым, Раздольненский р-н, Славновское сельское поселение, СНТ Отдых"
10 сот,550000.0,"Брянская область, Сельцо"
5.5 сот,250000.0,"Ставропольский край, Георгиевский г.о., станица Незлобная"
10 сот,550000.0,"Брянская область, Сельцо"
10 сот,590000.0,"Самарская область, Ставропольский р-н, с. Русская Борковка"
14 сот,800000.0,"Краснодарский край, Белореченский р-н, станица Рязанская"
5 сот,5000000.0,"Краснодарский край, муниципальное образование Анапа, с. Супсех"
22 сот,22000000.0,"Краснодарский край, г.о. Сочи, с. Нижняя Шиловка"
9 сот,280000.0,"Вологодская область, Нюксенский р-н, с. Нюксеница"
8 сот,560000.0,
32 сот,450000.0,
15 сот,900000.0,
8 сот,100000.0,"Иркутская область, Иркутский р-н, рабочий пос. Маркова"
10 сот,100000.0,"Пермский край, Пермский р-н"
16 сот,500000.0,"Тверская область, Кимрский р-н, д. Радомино"
4 сот,9750000.0,
4.2 сот,4500000.0,
8 сот,200000.0,
15 сот,100000.0,"Красноярский край, Лесосибирск"
13.8 сот,450000.0,"Республика Карелия, Костомукшский г.о., Костомукша"
25 сот,1500000.0,"Ленинградская область, Выборгский р-н, Красносельское сельское поселение, пос. Нагорное"
10 сот,500000.0,"Тамбовская область, Тамбовский р-н, д. Малиновка 1-я"
14 сот,250000.0,"Республика Башкортостан, Кармаскалинский р-н, с. Кармаскалы"
12.5 сот,950000.0,"Рязанская область, Рязанский р-н, Заборьевское сельское поселение, с. Заборье"
16.8 сот,1200000.0,"Московская область, Рузский г.о., д. Константиново"
20 сот,2500000.0,"Белгородская область, Белгородский р-н, с. Таврово"
10 сот,400000.0,"Свердловская область, Екатеринбург, коттеджный пос. Улесье"
2.7 сот,1000000.0,"Московская область, Одинцовский г.о., пос. НИИ Радио"
9 сот,600000.0,"Ленинградская область, Кингисеппский р-н, Кингисеппское городское поселение, Кингисепп, садоводческий массив Серёжино"
16 сот,265000.0,"Калужская область, Перемышльский р-н, д. Будаково"
8 сот,7500000.0,"Томская область, Томск"
21.1 сот,22000000.0,"Краснодарский край, Сочи"
10 сот,900000.0,"Ленинградская область, Гатчинский р-н, Сиверское городское поселение, д. Маргусы"
11.9 сот,1450000.0,"Новосибирская область, Новосибирский р-н, Кубовинский сельсовет, коттеджный пос. Лаки Парк"
15 сот,120000.0,"Псковская область, Печорский р-н, д. Зимний Борок"
6 сот,1050000.0,"Московская область, г.о. Домодедово, д. Редькино"
8.3 сот,186000.0,"Забайкальский край, Чита, ДНТ Учитель"
10.5 сот,590000.0,"Тверская область, Калининский р-н, Заволжское сельское поселение, садоводческое некоммерческое товарищество Межурка"
12 сот,1390000.0,"Республика Татарстан, Елабужский р-н, Поспеловское сельское поселение, с. Мальцево"
16 сот,590000.0,"Владимирская область, Суздальский р-н, с. Борисовское"
32 сот,3500000.0,"Владимирская область, Суздальский р-н, с. Заполицы"
10 сот,90000.0,"Архангельская область, Мирный"
12 сот,320000.0,"Ставропольский край, Ставрополь, садовое товарищество Встреча"
5 сот,355000.0,"Республика Дагестан, Карабудахкентский р-н"
15 сот,1250000.0,"Белгородская область, г.о. Старооскольский, Старый Оскол"
6 сот,950000.0,"Ростовская область, Новочеркасск"
11 сот,400000.0,"Республика Башкортостан, Иглинский р-н, с. Охлебинино"
25 сот,800000.0,"Республика Дагестан, Дербент"
6 сот,330000.0,"Курская область, Курск"
6.1 сот,80000.0,"Республика Башкортостан, Уфимский р-н, д. Начапкино"
19.2 сот,280000.0,"Тульская область, Заокский р-н, СНП Заповедные Поляны"
6 сот,1200000.0,"Краснодарский край, Новороссийск, СНТ Золотая рыбка"
9.3 сот,400000.0,"Мурманская область, Кольский р-н, сельское поселение Пушной, ДНТ Биолог ММБИ"
15 сот,230000.0,"Ставропольский край, Изобильненский г.о., с. Московское"
10 сот,425000.0,"Липецкая область, Елец"
7 сот,900000.0,"Воронежская область, Рамонский р-н, д. Медовка"
17 сот,1450000.0,"Калужская область, г.о. Калуга, д. Колюпаново"
1.8 га,500000.0,Республика Крым
8.7 сот,800000.0,"Самарская область, Чапаевск"
1.8 га,500000.0,Республика Крым
25 сот,1200000.0,"Белгородская область, Белгородский р-н, пос. городского типа Разумное"
11.5 сот,2200000.0,"Московская область, Пушкинский г.о., коттеджный пос. Китежградъ"
7 сот,700000.0,"Ленинградская область, Приозерский р-н, Ларионовское сельское поселение, СНТ Корела"
8 сот,750000.0,"Московская область, г.о. Чехов, садовое товарищество Ясное"
2.3 га,150000.0,"Карачаево-Черкесская Республика, Усть-Джегутинский р-н, Усть-Джегута"
14.25 га,1425.0,
12 сот,130000.0,
16 сот,150000.0,
7 сот,1850000.0,"Краснодарский край, муниципальное образование Анапа, станица Гостагаевская"
