land_area,price,region
28 сот,1000000.0,"Тамбовская область, Тамбовский р-н, Татановский сельсовет, с. Татаново"
10 сот,1050000.0,"Ростовская область, Аксайский р-н, Большелогское сельское поселение, пос. Российский"
10 га,2050000.0,"Самарская область, Новокуйбышевск"
32 сот,450000.0,"Ставропольский край, Грачёвский муниципальный р-н, с. Тугулук"
12 сот,1600000.0,"Московская область, г.о. Истра, д. Карасино"
15 сот,1250000.0,"Владимирская область, Суздальский р-н, с. Суромна"
14 сот,500000.0,"Тюменская область, Ишимский р-н, д. Синицына"
7.8 сот,470000.0,"Калужская область, Малоярославецкий р-н, сельское поселение Деревня Шумятино, д. Терентьево"
10 сот,550000.0,"Московская область, г.о. Клин, д. Праслово"
11 сот,450000.0,"Московская область, г.о. Серпухов, д. Балково"
6 сот,1000000.0,"Карачаево-Черкесская Республика, Черкесск"
8.5 сот,680000.0,"Новосибирская область, Новосибирский р-н, Криводановский сельсовет, с. Криводановка"
10 сот,1500000.0,"Республика Дагестан, г.о. Махачкала, пос. городского типа Семендер"
7 сот,9100000.0,"Самарская область, Самара"
15 сот,700000.0,"Московская область, Сергиево-Посадский г.о., д. Киримово"
7 сот,700000.0,"Республика Дагестан, Кумторкалинский р-н, с. Коркмаскала"
6 сот,1000000.0,"Карачаево-Черкесская Республика, Черкесск"
20 сот,1400000.0,"Новосибирская область, Новосибирский р-н, Барышевский сельсовет, с. Барышево"
26 сот,600000.0,"Смоленская область, Гагаринский р-н, д. Батюшково"
15 сот,60000.0,"Новгородская область, Новгородский р-н, Трубичинское сельское поселение, д. Некохово"
19 сот,300000.0,"Ивановская область, Лежневский р-н, с. Воскресенское"
10 сот,500000.0,"Республика Коми, г.о. Сыктывкар, пос. городского типа Краснозатонский"
10 сот,1550000.0,"Республика Адыгея, Тахтамукайский р-н, аул Старобжегокай"
25 сот,3750000.0,"Краснодарский край, Северский р-н, станица Крепостная"
6 сот,1900000.0,"Краснодарский край, муниципальное образование Анапа, пос. Суворов-Черкесский"
10 сот,700000.0,"Нижегородская область, Богородский муниципальный округ, д. Шумилово"
4 га,6000000.0,"Саратовская область, Воскресенский р-н, с. Чардым"
6 сот,400000.0,"Оренбургская область, Оренбург"
2.12 га,280000000.0,Санкт-Петербург
8 сот,360000.0,
12 сот,1250000.0,
7 сот,1399000.0,
8.3 сот,1400000.0,"Ленинградская область, Всеволожский р-н, Рахьинское городское поселение, д. Проба"
15 сот,750000.0,"Смоленская область, Смоленский р-н, д. Ясенная"
6 сот,160000.0,"Тюменская область, Сургутский р-н, потребительский садово-огородный кооператив № 5 Транспортный Строитель"
13 сот,850000.0,
10 сот,2100000.0,
13.5 сот,460000.0,
6 сот,400000.0,"Краснодарский край, Приморско-Ахтарский р-н, Приморско-Ахтарск, садовое товарищество Маяк"
15 сот,300000.0,"Липецкая область, Хлевенский р-н, с. Хлевное"
7 сот,2840000.0,"Краснодарский край, Туапсинский р-н, с. Шепси"
25 сот,460000.0,"Смоленская область, Гагаринский р-н, д. Ивашково"
10 сот,900000.0,"Республика Татарстан, Высокогорский р-н"
5 га,2500000.0,"Московская область, Шатура"
5.1 сот,700000.0,"Ростовская область, Аксайский р-н, Щепкинское сельское поселение, хутор Нижнетемерницкий, коттеджный пос. Прилесный"
5 га,500000.0,"Республика Дагестан, Дербент"
8 сот,769000.0,"Московская область, г.о. Щёлково"
6 сот,285000.0,"Тверская область, Конаковский р-н, СНТ Майский"
15 сот,240000.0,"Челябинская область, Сосновский р-н"
10.5 сот,300000.0,"Удмуртская Республика, Воткинский р-н, СНТ Яблонька"
6.5 сот,290000.0,"Иркутская область, Иркутский р-н, СНТ Илга"
4.7 сот,160000.0,"Пермский край, Чайковский г.о., Чайковский, СНТ № 36"
25 сот,200000.0,"Смоленская область, Вяземский р-н, д. Володарец"
15 сот,1800000.0,"Республика Татарстан, Лаишевский р-н"
10 сот,270000.0,"Липецкая область, Липецк, коттеджный пос. Радужный"
6 сот,200000.0,"Воронежская область, Семилукский р-н, СНТ Лосево"
12.8 сот,350000.0,"Тульская область, Узловский р-н, Узловая"
1.50 га,4000000.0,"Ленинградская область, Приозерский р-н, Плодовское сельское поселение"
15 сот,1700000.0,"Московская область, Раменский г.о., д. Малышево"
15 сот,970000.0,"Московская область, г.о. Воскресенск, рабочий пос. Хорлово"
14 сот,700000.0,"Калужская область, Бабынинский р-н, городское поселение Посёлок Воротынск, пос. Воротынск"
18 сот,920000.0,"Краснодарский край, Абинский р-н, пос. городского типа Ахтырский"
55 сот,3500000.0,"Краснодарский край, Тимашевский муниципальный р-н, хутор Лютых"
16 сот,990000.0,"Пермский край, Пермский р-н, Сылвенское сельское поселение"
9 сот,390000.0,"Курская область, Курский р-н, садоводческое некоммерческое товарищество Тускарь"
16 сот,650000.0,"Московская область, Раменский г.о., д. Булгаково"
17 сот,40000.0,"Белгородская область, Губкинский г.о., с. Архангельское"
10 сот,100000.0,"Смоленская область, Смоленский р-н, д. Кощино"
6 сот,149000.0,"Республика Татарстан, Высокогорский р-н, садоводческое некоммерческое товарищество Сосенка"
5 сот,400000.0,"Республика Адыгея, Тахтамукайский р-н, СНТ Берег Афипса"
12 сот,382000.0,"Московская область, г.о. Шаховская, ДНП Удачные"
20 сот,350000.0,"Свердловская область, Полевской г.о., с. Косой Брод"
10 сот,160000.0,"Тюменская область, г.о. Тюмень, садовое товарищество Зелёная Роща"
10 сот,35000.0,"Республика Коми, г.о. Сыктывкар, территория Максаковское, СНТ Огонёк"
7 сот,1570000.0,"Краснодарский край, муниципальное образование Краснодар, садовое товарищество Авангард"
4 сот,350000.0,"Тюменская область, Урай"
4 сот,35000.0,"Свердловская область, Кушвинский г.о."
9 га,4500000.0,"Республика Алтай, Чемальский р-н, с. Элекмонар"
4 сот,350000.0,"Тюменская область, Урай"
6 сот,400000.0,"Московская область, г.о. Электрогорск, садовое товарищество Дальний"
15 сот,3000000.0,"Нижегородская область, г.о. Бор, д. Борисовка"
10 сот,2550000.0,"Севастополь, Балаклавский р-н, Балаклавский муниципальный округ, пос. Сахарная Головка"
6 сот,45000.0,"Самарская область, Волжский р-н, пос. городского типа Смышляевка, СТ Зелёная роща"
9 га,4500000.0,"Республика Алтай, Чемальский р-н, с. Элекмонар"
10 сот,600000.0,"Курская область, Курск"
15 сот,3500000.0,
50 сот,70000.0,
10 сот,325000.0,
15 сот,580000.0,"Архангельская область, Пинежский р-н, муниципальное образование Сийское"
10 сот,1800000.0,"Московская область, Луховицы"
26 сот,2500000.0,"Пермский край, Пермский р-н, Гамовское сельское поселение, д. Заречная"
10 га,3700000.0,
15 сот,900000.0,
2 га,2000000.0,
13 сот,850000.0,"Иркутская область, Иркутский р-н, с. Хомутово"
8 сот,5000.0,"Московская область, Одинцовский г.о., Голицыно"
17 сот,1700000.0,"Краснодарский край, Северский р-н, станица Азовская"
18 сот,2600000.0,"Московская область, г.о. Чехов, д. Оксино"
7 сот,500000.0,"Московская область, Наро-Фоминский г.о., садовое некоммерческое товарищество Дорожник"
12 сот,880000.0,"Московская область, г.о. Солнечногорск, садовое товарищество Лутосня"
16.7 сот,690000.0,"Ростовская область, Азовский р-н, с. Стефанидинодар"
24.5 сот,4500000.0,"Краснодарский край, Темрюкский р-н, пос. Пересыпь"
20 сот,380000.0,"Рязанская область, Спасский р-н, с. Половское"
27.56 га,110000000.0,"Московская область, г.о. Истра, д. Сафонтьево"
5 га,500000.0,"Московская область, г.о. Кашира"
48 сот,400000.0,"Республика Татарстан, Лениногорский р-н, с. Старая Письмянка"
10 сот,425000.0,"Карачаево-Черкесская Республика, Абазинский р-н, Псыжское сельское поселение, аул Псыж"
6.4 сот,4500000.0,"Московская область, Балашиха"
6 сот,300000.0,"Московская область, Можайский г.о., СНТ Юбилейный"
9.7 сот,750000.0,"Московская область, г.о. Чехов, д. Масново-Жуково"
1.1 га,8216667.0,"Тверская область, Торжокский р-н, Мирновское сельское поселение"
10 сот,1250000.0,"Тульская область, Тула"
5 сот,2500000.0,"Краснодарский край, Сочи"
9.5 сот,850000.0,"Краснодарский край, Динской р-н, с. Красносельское"
14 сот,2856000.0,"Тверская область, Калининский р-н, Никулинское сельское поселение, д. Красново, коттеджный пос. Красново"
20 сот,200000.0,"Белгородская область, Шебекинский г.о., с. Нехотеевка"
1.1 га,8216667.0,"Тверская область, Торжокский р-н, Мирновское сельское поселение"
6 сот,4800000.0,"Краснодарский край, г.о. Сочи, с. Верхнениколаевское"
6 сот,320000.0,"Ставропольский край, Ставрополь, садовое товарищество Виола"
10 сот,600000.0,"Рязанская область, Рязанский р-н, Тюшевское сельское поселение, с. Тюшево"
6 сот,350000.0,Республика Крым
9 сот,350000.0,"Ставропольский край, г.о. Ставрополь, садовое товарищество Ромашка"
6 сот,240000.0,"Нижегородская область, Богородский муниципальный округ, д. Шумилово"
7 сот,1600000.0,"Ставропольский край, Ставрополь, садовое товарищество Мечта-2"
12.1 сот,72600.0,"Красноярский край, Берёзовский р-н"
6 сот,290000.0,"Тюменская область, Сургут, садовое товарищество Ветеран"
10 сот,590000.0,"Республика Крым, Бахчисарайский р-н, Почтовское сельское поселение, с. Приятное Свидание"
1.78 га,8925500.0,"Тверская область, Бологовский р-н, Куженкинское сельское поселение"
10 сот,650000.0,"Республика Крым, Симферопольский р-н, Николаевское сельское поселение, пос. городского типа Николаевка"
12 сот,400000.0,"Калининградская область, Полесский муниципальный округ, пос. Красное"
6.5 сот,1500000.0,"Республика Крым, Симферопольский р-н, Перовское сельское поселение, садоводческий потребительский кооператив Межгорье"
5.4 сот,4200000.0,"Краснодарский край, Супсех"
24 га,2500000.0,"Рязанская область, Шацкий р-н, с. Малое Агишево"
8 сот,3950000.0,"Кабардино-Балкарская Республика, Нальчик"
6 сот,2580000.0,"Москва, Троицкий административный округ, поселение Первомайское"
8 сот,3950000.0,"Кабардино-Балкарская Республика, Нальчик"
70 сот,700000.0,"Нижегородская область, Городецкий р-н, д. Иконниково"
10 сот,75000.0,"Пермский край, Краснокамский г.о., СНТ Весёлый Садовод"
11.1 сот,2700000.0,"Московская область, г.о. Солнечногорск, д. Пикино"
8 га,11000000.0,"Краснодарский край, муниципальное образование Анапа, хутор Нижняя Гостагайка"
24 га,2500000.0,"Рязанская область, Шацкий р-н, с. Малое Агишево"
15 сот,1290000.0,
12 сот,2580000.0,
5 сот,208000.0,
7.5 сот,750000.0,"Пермский край, Пермский р-н, Култаевское сельское поселение, с. Култаево"
8 сот,500000.0,"Краснодарский край, муниципальное образование Краснодар, станица Елизаветинская, садовое товарищество Кубаночка"
10 сот,210000.0,"Челябинская область, Увельский р-н, пос. Увельский"
9.5 сот,5000000.0,
6 сот,1290000.0,
18 сот,1440000.0,
18 сот,350000.0,"Смоленская область, Смоленск"
20 сот,100000.0,"Красноярский край, Емельяновский р-н, пос. городского типа Емельяново"
10 сот,250000.0,"Республика Татарстан, Верхнеуслонский р-н, садоводческое некоммерческое товарищество Мостовик"
8 сот,690000.0,"Тверская область, Калининский р-н, Аввакумовское сельское поселение, садоводческое некоммерческое товарищество Спутник-Искож"
15 сот,500000.0,"Республика Дагестан, Хасавюртовский р-н, с. Тотурбийкала"
10 сот,2200000.0,"Республика Крым, г.о. Алушта, пос. Семидворье"
13 сот,420000.0,"Республика Башкортостан, Бирский р-н, Городское поселение город Бирск, Бирск"
15 сот,600000.0,"Краснодарский край, г.о. Анапа, хутор Иванов"
6 сот,400000.0,"Республика Башкортостан, Стерлитамак, садовое некоммерческое товарищество Ильмень"
31 сот,500000.0,"Пермский край, Пермский р-н, Юго-Камское сельское поселение, пос. Юго-Камский"
78 сот,2422665.0,"Тверская область, Бологовский р-н, с. Куженкино"
17 сот,400000.0,"Красноярский край, Берёзовский р-н, пос. Берёзовский"
14 сот,300000.0,"Ставропольский край, Кировский г.о., станица Советская"
32 сот,3000000.0,"Кабардино-Балкарская Республика, Чегемский р-н, с. Шалушка"
28 сот,450000.0,"Краснодарский край, Павловский р-н, хутор Первомайский"
21.8 сот,1000000.0,"Калужская область, Тарусский р-н, д. Паршино"
16 сот,600000.0,"Кабардино-Балкарская Республика, Баксанский р-н, с. Исламей"
10 сот,100000.0,"Омская область, Омский р-н, д. Зелёное Поле"
31 сот,1280000.0,"Краснодарский край, Абинский р-н, станица Фёдоровская"
7.5 сот,2500000.0,"Московская область, Дмитровский г.о., д. Животино"
5 сот,400000.0,"Республика Крым, Симферопольский р-н, Перовское сельское поселение, садоводческий потребительский кооператив Межгорье"
15 сот,675000.0,"Ленинградская область, Лужский р-н, Мшинское сельское поселение, д. Большая Ящера"
12 сот,950000.0,"Воронежская область, Новоусманский р-н, с. Новая Усмань"
6.1 сот,3650000.0,"Московская область, г.о. Мытищи, д. Ерёмино"
28 сот,75000.0,"Кировская область, Кумёнский р-н, Речное сельское поселение, д. Слудное"
15.5 сот,3290000.0,"Московская область, Одинцовский г.о., садоводческое товарищество Вязы"
1.3 га,130000000.0,"Челябинская область, Челябинск"
1 сот,80000.0,"Республика Северная Осетия — Алания, Пригородный р-н, с. Кобан"
18 сот,500000.0,"Воронежская область, Новоусманский р-н, с. Рыкань"
8 сот,850000.0,"Тюменская область, Сургут, садовое товарищество Берендей"
2 га,300000.0,"Республика Крым, Сакский р-н, Геройское сельское поселение, с. Геройское"
12 га,500000.0,"Республика Дагестан, Кизлярский р-н, с. Рыбалко"
12 сот,270000.0,"Московская область, Наро-Фоминский г.о., садовые участки Цвет"
13 сот,320000.0,"Красноярский край, Красноярск"
7 сот,1050000.0,"Калининградская область, Балтийский г.о., Приморск"
11.5 сот,2150000.0,"Свердловская область, Берёзовский г.о., пос. Старопышминск"
6 сот,1200000.0,"Московская область, г.о. Пушкинский"
6 сот,400000.0,"Ивановская область, Тейковский р-н, д. Горки"
136 га,6800000.0,"Калужская область, Дзержинский р-н, д. Звизжи"
10 сот,220000.0,"Ленинградская область, Лужский р-н, Мшинское сельское поселение, садоводческий массив Дивенская"
10 сот,220000.0,"Ленинградская область, Лужский р-н, Мшинское сельское поселение, садоводческий массив Дивенская"
16 сот,16000000.0,Севастополь
10.7 сот,300000.0,"Краснодарский край, Абинский р-н, станица Холмская"
3.37 га,999999.0,"Республика Крым, Сакский р-н, с. Геройское"
15 сот,290000.0,"Челябинская область, г.о. Миасс, с. Смородинка"
10 сот,200000.0,"Рязанская область, Рязанский р-н, Заборьевское сельское поселение, с. Агро-Пустынь"
,,"Республика Татарстан, Зеленодольский р-н, Зеленодольск"
10 сот,240000.0,
10 сот,3600000.0,
10 сот,99000.0,
15 сот,560000.0,"Владимирская область, Ковровский р-н, Клязьминское сельское поселение, д. Старая"
6.9 сот,400000.0,"Владимирская область, Ковров"
10 сот,950000.0,"Республика Адыгея, Теучежский р-н, Тлюстенхабльское городское поселение, пос. городского типа Тлюстенхабль"
11 сот,450000.0,
11 сот,2050000.0,
6 сот,400000.0,
1.4 га,400000.0,"Ставропольский край, г.о. Пятигорск, станица Константиновская"
6.2 сот,200000.0,"Орловская область, Орловский муниципальный округ, д. Образцово"
8.1 сот,500000.0,"Владимирская область, Ковров"
10 сот,840000.0,"Свердловская область, Екатеринбург"
19 сот,1850000.0,"Республика Марий Эл, Звениговский р-н, Кокшайское сельское поселение"
4 сот,2400000.0,"Краснодарский край, г.о. Новороссийск, с. Мысхако"
8 сот,500000.0,"Владимирская область, Петушинский р-н, муниципальное образование Город Петушки, Петушки"
11 сот,350000.0,"Калужская область, Дзержинский р-н, Кондрово"
9.5 сот,10500000.0,"Свердловская область, Екатеринбург"
20 сот,360000.0,"Владимирская область, Камешковский р-н, д. Мишнево"
15 сот,450000.0,"Республика Татарстан, Лаишевский р-н, с. Малая Елга"
4 сот,4500000.0,"Республика Адыгея, Тахтамукайский р-н, пос. Перекатный"
8 сот,4500000.0,"Краснодарский край, Тимашевский муниципальный р-н, Тимашевск"
4 сот,2700000.0,"Краснодарский край, муниципальное образование Анапа, с. Цибанобалка"
6 га,200000.0,"Республика Крым, Симферопольский р-н"
14.1 сот,1450000.0,"Томская область, Томский р-н, д. Кисловка"
6 сот,615000.0,"Московская область, г.о. Чехов, д. Филипповское"
12 сот,250000.0,"Пермский край, муниципальное образование Город Березники, пос. Николаев Посад"
